{
  "taskId": "11111111-1111-4111-8111-111111111111",
  "stepId": "33333333-3333-4333-8333-333333333333",
  "approvalId": "22222222-2222-4222-8222-222222222222",
  "revisionNo": 1,
  "status": "ACTIVE",
  "approvalDigest": "bbbbbbbbbbbbbbbbbbbbbbbbbbbbbbbbbbbbbbbbbbbbbbbbbbbbbbbbbbbbbbbb",
  "expiresAt": "2026-09-28T10:00:00Z",
  "rowVersion": 2,
  "decision": "APPROVED"
}
